{
  "stage_id": "18.18",
  "full_overnight_candidate_allowed": false,
  "controlled_run_allowed": false,
  "longer_supervised_run_allowed": false,
  "red_team_review_required": true,
  "human_approval_required": true,
  "live_trading_status": "BLOCKED",
  "broker_execution_status": "BLOCKED",
  "oanda_status": "BLOCKED",
  "pi_gpio_motor_status": "BLOCKED",
  "profitability_priority": "TRUSTED_PROVEN_PROFITABILITY",
  "fail_closed": true
}

